주소,위도,경도
전남 해남군 해남읍 남부순환로 64,34.5660213,126.6043879
전남 해남군 삼산면 해남화산로 279,34.5384016,126.5674383
전남 해남군 해남읍 해남화산로 139,34.5479635,126.5761861
전남 해남군 현산면 땅끝대로 1711,34.4676132,126.5496442
전남 해남군 해남읍 남부순환로 102,34.5651304,126.600505
전남 해남군 화산면 해남화산로 1045,34.4927538,126.5148099
전남 해남군 화원면 관광레저로 1249,34.6674146,126.3273051
전남 해남군 화원면 관광레저로 1182,34.6714351,126.3335865
전남 해남군 황산면 명량로 1604,34.5775153,126.4459453
전남 화순군 능주면 화보로 3552,35.013841,126.9504805
전라남도 화순군 춘양면 화보로 2553,34.9386977,126.9836007
전남 화순군 화순읍 충의로 164,35.0533377,126.9940857
전남 화순군 화순읍 서양로 376,35.0649956,126.9988741
전남 화순군 화순읍 화보로 4305,35.0699385,126.9731666
전남 화순군 지석로 1456,34.9947999,126.9524938
전남 화순군 능주면 화보로 3545,35.0110094,126.9502666
전남 화순군 화순읍 화보로 4157,35.0588514,126.9756383
전남 화순군 도곡면 지석로 1180,34.9971929,126.9249342
전남 화순군 북면 백아로 2204,35.1600209,127.0857477
전남 화순군 동복면 오지호로 316,35.0731217,127.1280962
전남 화순군 화순읍 학포로 2632,35.0445112,126.9636752
전남 화순군 남면 사호로 276,35.0063173,127.1009003
전남 화순군 화순읍 충의로 108,35.0552356,126.9895801
전남 화순군 춘양면 학포로 1407,34.9529746,126.9670599
전남 화순군 화순읍 화보로 4151,35.0585138,126.975261
전남 화순군 화순읍 서양로 480,35.0685261,126.9885151
전남 화순군 능주면 화보로 3540,35.0129122,126.9499128
전남 화순군 이양면 학포로 605,34.8915158,126.9879817
전남 화순군 도암면 천태로 5,34.9104546,126.8733246
전남 화순군 청풍면 학포로 484,34.8812437,126.9866462
전남 화순군 한천면 화보로 3042,34.938992,126.9834748
전남 화순군 화순읍 화보로 3901,35.0406091,126.9652676
전남 화순군 도곡면 천암1길 48,35.0112669,126.9102135
전남 화순군 남면 사호로 223,35.0075834,127.0953867
전남 화순군 동면 충의로 833,35.0300716,127.0471526
전남 화순군 화순읍 칠충로 7,35.0534259,126.9733021
전남 화순군 화순읍 화보로 3904,35.0402494,126.9659035
전남 화순군 화순읍 지강로 841,35.06616560000001,126.9117954
전남 화순군 화순읍 오성로 384,35.0507435,126.9509809
전남 화순군 동면 동주로 205,35.0450595,127.0814053
전남 화순군 동복면 동주로 1414,35.07946039999999,127.1737976
전남 화순군 화순읍 충의로 18,35.05544709999999,126.9796272
전남 화순군 이서면 적벽로 853,35.1109903,127.0704994
전남 화순군 화순읍 쌍충로 74,35.058633,126.9825682
전북 고창군 고창읍 녹두로 1033,35.4358618,126.659046
전북 고창군 신림면 고인돌대로 2430,35.4955327,126.701355
전북 고창군 신림면 서해안고속도로 80-1,35.4624562,126.6740731
전북 고창군 신림면 서해안고속도로 81-1,35.4672935,126.6732567
전북 고창군 고창읍 녹두로 1171,35.4349803,126.6743079
전북 고창군 고인돌대로 1926,35.4512266,126.6969133
전북 고창군 부안면 인촌로 1230,35.5156016,126.6743716
전북 고창군 고창읍 고인돌대로 1772,35.4380151,126.6929963
전북 고창군 공음면 선운대로 31,35.3825679,126.508448
전북 고창군 고창읍 중앙로 148,35.4351711,126.6915467
전북 고창군 무장면 학천로 18,35.413929,126.5628808
전북 고창군 신림면 고인돌대로 1997,35.4576031,126.6962101
전북 고창군 고창읍 동서대로 1884,35.43472,126.7060091
전북 고창군 고수면 고인돌대로 1428,35.4111499,126.6793642
전북 고창군 흥덕면 부안로 261,35.5425976,126.6973744
전북 고창군 성송면 대성로 741,35.3623388,126.6441457
전북 고창군 대산면 대성로 284,35.3408723,126.6044973
전북 고창군 대산면 대성로 207,35.337308,126.5976784
전북 고창군 무장면 녹두로 82,35.4227235,126.5670179
전북 고창군 상하면 상하로 50,35.4428248,126.491658
전북 고창군 신림면 고인돌대로 2104,35.4667599,126.6984961
전북 고창군 흥덕면 선운대로 3719,35.5188017,126.6986718
전북 고창군 고창읍 동서대로 2527,35.42779100000001,126.7229401
전북 고창군 무장면 동서대로 906,35.4372348,126.551062
전북 고창군 고창읍 모양성로 78,35.4381877,126.6998845
전북 고창군 고창읍 고인돌대로 2222,35.4366499,126.6924586
전북 고창군 심원면 심원로 215,35.5242267,126.5516108
전북 고창군 아산면 녹두로 805,35.4402415,126.636847
전북 고창군 대산면 영대로 1032,35.3199166,126.5765937
전북 고창군 성내면 선운대로 4373,35.5493158,126.7572239
전북 고창군 신림면 왕림로 521,35.4938474,126.7334213
전북 고창군 공음면 왕제산로 151-3,35.383634,126.5197213
전북 고창군 아산면 녹두로 924,35.4346424,126.647332
전북 고창군 해리면 희어재로 13,35.4588403,126.5445527
전북 고창군 심원면 선운대로 2158,35.5388665,126.5690635
전북 고창군 고수면 고인돌대로 1225,35.3958994,126.6685184
전북 고창군 상하면 상하로 78,35.4445734,126.4941211
전북 고창군 해리면 해리중앙로 142,35.4643765,126.5375059
전북 고창군 고창읍 고인돌대로 1554,35.4191126,126.6886727
전북 고창군 고창읍 중거리당산로 29,35.4244792,126.6926743
전북 고창군 흥덕면 고인돌대로 2688,35.5161028,126.7059196
전북 군산시 외항로 223 ,35.9623613,126.5984206
전북 군산시 옥산면 옥산로 157,35.9489546,126.7479814
전북 군산시 외항로 319 ,35.9680655,126.6347557
전북 군산시 외항로 269 ,35.9690011,126.639448
전북 군산시 월명로 408,35.9804973,126.7149746
전북 군산시 공항로 300 ,35.963254,126.6614145
전라 군산시 외항로 163,35.9718972,126.6510574
전북 군산시 동장산로 5 ,35.9485926,126.5870374
전북 군산시 외항로 399 ,35.9660513,126.6256786
전북 군산시 공단대로 284 ,35.9596279,126.7103421
전북 군산시 공단대로 360 ,35.9616439,126.7024762
전북 군산시 자유무역로 4 ,35.9448304,126.5498286
전북 군산시 회현면 회현로 155,35.9141135,126.7540049
전북 군산시 새만금북로 534-5 ,35.9483672,126.5956324
전북 군산시 번영로 319 ,35.9638624,126.7521506
전북 군산시 공단대로 90 ,35.9599391,126.7315036
전북 군산시 외항6길 6 ,35.9703442,126.6401822
전북 군산시 옥서면 선연길 8,35.9264653,126.6183793
전북 군산시 군산시 서해안고속도로 148,35.9805744,126.8289603
전북 군산시 성산면 군익로 111,35.983118,126.7885934
전북 군산시 서해안고속도로 141,35.9805744,126.8289603
전북 군산시 월명로 315 ,35.972255,126.7151936
전북 군산시 미성로 104,35.95703719999999,126.6560671
전북 군산시 해망로 127,35.9862207,126.7230401
전북 군산시 대야면 만경로 1648,35.921529,126.8328325
전북 군산시 백릉로 227 ,35.9790198,126.7494017
전북 군산시 개정면 번영로 692,35.9560261,126.7919691
전북 군산시 옥구읍 상평로 16,35.9233674,126.6876736
전북 군산시 옥녀로 102,35.956602,126.6199685
전북 군산시 공단대로 673,35.9764035,126.6745997
전북 군산시 옥산면 월명로 81,35.950974,126.7152922
전북 군산시 대야면 번영로 916,35.9451964,126.8121796
전북 군산시 공항로 218 ,35.9682098,126.6677976
전북 군산시 대학로 487 ,35.9518828,126.6861835
전북 군산시 옥서면 공항로 702,35.9295483,126.6411119
전북 군산시 나포면 십자들로 622,36.0293072,126.8303759
전북 군산시 대야면 만경로 1767,35.9308839,126.8267941
전북 군산시 임피면 동군산로 843,35.9939613,126.8597051
전북 군산시 성산면 동군산로 467,35.9843048,126.8254715
전북 군산시 미원로 57 ,35.9781404,126.7113549
전북 군산시 구암로 176,35.9838617,126.7583737
전북 군산시 번영로 447-3 ,35.9632575,126.7661661
전북 군산시 공항로 579 ,35.9393872,126.6529456
전북 군산시 서수면 동군산로 1118,36.0124338,126.8786644
전북 군산시 진포로 201,35.9766195,126.7327114
전북 군산시 해망로 671 ,35.9777821,126.6695294
전북 군산시 공항로 434,35.9523539,126.6558823
전북 군산시 대학로 618,35.9401808,126.6857554
전북 군산시 미성로 458 ,35.9554706,126.6711984
전북 군산시 공항로 476,35.94859040000001,126.6551668
전북 군산시  해망로 580 ,35.9817233,126.6793176
전북 군산시 외항로 131,35.9729366,126.6543759
전북 군산시 공항로 262-1,35.9654555,126.6642996
전북 군산시 대야면 번영로 955,35.9442794,126.8166954
전북 군산시 대야면 번영로 1321,35.93717530000001,126.8559864
전북 군산시 구암로 158 ,35.9833871,126.7563198
전북 군산시 문창2길 1,35.9537752,126.6560477
전북 군산시 항쟁로 177,35.9832018,126.8740826
전북 군산시 서수면 동군산로 984,36.0030558,126.8696898
전북 군산시 옥녀로 18,35.9642582,126.6213906
전북 군산시 성산면 철새로 52,36.0156441,126.760895
전북 군산시 구암로 137 ,35.9838919,126.753808
전북 군산시 미성로 442 ,35.9556418,126.6693211
전북 군산시 개정면 번영로 846,35.9481655,126.8053119
전북 군산시 옥녀로 36  ,35.9609044,126.6158006
전북 군산시 옥산면 월명로 58,35.9485313,126.7163515
전북 군산시 옥산로 16,35.9428166,126.7492245
전북 군산시 외항로 195 ,35.9709823,126.6476017
전북 군산시 번영로 167 ,35.9648331,126.7372566
전북 군산시 공단대로 67 ,35.9593764,126.7346353
전북 군산시 외항로 565 ,35.9635033,126.6083857
전북 군산시 외항로 83 ,35.9744615,126.6593637
전북 군산시 외항로 111 ,35.9736974,126.6564784
전북 군산시 공단대로 620,35.9736136,126.6797809
전북 군산시 해망로 252,35.9910841,126.7106043
전북 군산시 대학로 191 ,35.974729,126.702384
전북 군산시 옥구읍 옥구로 39,35.9204731,126.6696889
전라북도 군산시 옥산면 산성로 222 ,35.9411477,126.7493437
전북 군산시 해망로 517 ,35.9831836,126.6859952
전북 군산시 구암로 97 ,35.9828929,126.7491787
전북 군산시 성산면 동군산로 93,35.9894264,126.7912438
전북 군산시 대학로 426 ,35.956812,126.6885993
전북 군산시 월명로 148 ,35.9570034,126.7161357
전북 군산시 임피면 서원석곡로 592,35.9828246,126.8503734
전북 군산시 공항로 157 ,35.971406,126.6732852
전북 군산시 새만금북로 794 ,35.9531578,126.6229004
전북 군산시 공단대로 552 ,35.9697305,126.6853944
전북 군산시 중앙로 188 ,35.98806039999999,126.7105138
전북 군산시 동장산로 150 ,35.9614395,126.5873341
전북 군산시  대학로 382 ,35.9604249,126.6909728
전북 군산시 구암3.1로 137 ,35.9827419,126.7348656
전북 군산시 옥산면 옥산로 154,35.9488644,126.7469376
전북 군산시 공단대로 567 ,35.9702932,126.6834516
전북 군산시 해망로 370 ,35.9903201,126.7000217
전북 군산시 성산면 십자들로 189,36.0097452,126.7959985
전북 군산시 임피면 항쟁로 46,35.9855139,126.8603812
전북 군산시 서수면 함안로 431,36.0238266,126.8791509
전북 군산시 개정면 구암로 234,35.9851938,126.7644918
전북 군산시  공항로 368 ,35.958107,126.6569786
전북 군산시 월명로 115 ,35.9540442,126.7152547
전북 군산시 장미2길27,35.98824,126.7154102
전북 군산시 번영로 202 ,35.9623149,126.7393842
전북 군산시 번영로 144,35.966094,126.7346955
전북 군산시 강변로 204 ,35.9889164,126.7451701
전북 군산시 대야면 번영로 1238,35.9381846,126.8466525
전북 군산시 팔마로 104 ,35.9734362,126.7125501
전북 군산시 구암로 78 ,35.9820965,126.7474792
전북 김제시 공덕면 하공로 633,35.8592822,126.9144765
전북 김제시 금구면 선비로 905,35.7827853,127.0147553
전북 김제시 벽성로 323,35.8025964,126.8714834
전북 김제시 금산면 선비로 500,35.7522532,127.001911
전라북도 김제시 하공로 780,35.8716428,126.9103425
전북 김제시 콩쥐팥쥐로 10 ,35.805193,126.9065852
전북 김제시 월죽로 949,35.79946109999999,126.8680561
전북 김제시 공덕면 공덕7길 10,35.8910772,126.9118518
전북 김제시 공덕면 유강로 85,35.8672668,126.9196969
전북 김제시 광활면 광활로 470,35.8324965,126.7399701
전북 김제시 금구면 선비로 799-3,35.7768898,127.0055462
전북 김제시 금산면 금산사로 159,35.7159748,127.0077116
전북 김제시 만경읍 만경로 780,35.8496276,126.8168114
전북 김제시 금산면 봉황로 15,35.7130466,126.9909198
전북 김제시 금산면 원평로 152,35.721883,126.9945807
전북 김제시 부량면 벽골제로 224,35.7353483,126.8444124
전북 김제시 죽산면 해학로 7,35.7700741,126.8163287
전북 김제시 월죽로 989 ,35.7998376,126.872631
전북 김제시 벽성로 371 ,35.8062041,126.8741509
전북 김제시 백구면 번영로 2188,35.9085437,126.9403459
전북 김제시 복죽7길 6 ,35.8029132,126.8506858
전북 김제시 용지면 콩쥐팥쥐로 878,35.8175434,126.995951
전북 김제시 금구면 봉두4길 59-50,35.7756119,127.0067621
전북 김제시 봉황로 1488 ,35.7905861,126.9372857
전북 김제시 남북로 28 ,35.7924879,126.8980388
전북 김제시 백구면 유강로 509-5,35.8990383,126.9343769
전북 김제시 금구면 콩쥐팥쥐로 626,35.8154306,126.9692099
전북 김제시 죽산면 서포길 204,35.7627556,126.7965259
전북 김제시 백구면 번영로 2347,35.9037336,126.9564065
전북 김제시 백산면 학당길 26,35.8273424,126.8919527
전북 김제시 진봉면 만경로 697,35.8421302,126.8158335
전북 김제시 성덕면 해학로 872,35.840378,126.8161009
전북 김제시 백구면 번영로 2876,35.8762407,126.9995962
전북 김제시 콩쥐팥쥐로 258 ,35.8164759,126.9297835
전북 김제시 금구면 풍요로 795,35.7869495,126.9851913
전북 김제시 벽성로 420 ,35.8082156,126.8789588
전북 김제시 벽지산로 232 ,35.7965051,126.878277
전북 김제시 성덕면 해학로 380,35.8017067,126.8052353
전북 김제시 콩쥐팥쥐로 44,35.8063454,126.9101276
전북 김제시 벽성로 608 ,35.8086766,126.898603
전북 김제시 벽성로 673,35.8066126,126.9053066
전북 김제시 금구면 구성길 720,35.7571751,127.0021149
전북 김제시 남북로 4 ,35.7915153,126.9000998
전북 김제시 하공로 40,35.8138389,126.8889757
전북 김제시 동서로 290 ,35.8032631,126.8988636
전북 김제시 중앙로 285 ,35.7935956,126.9018865
전북 김제시 하공로 120 ,35.8200251,126.8934477
전북 김제시 동서로 330,35.804131,126.9029951
전북 김제시 번영로 2492,35.8937784,126.9662357
전북 김제시 만경읍 만경로 1187,35.8840004,126.8272047
전북 김제시 청하면 청하로 396,35.8928901,126.8442639
전북 김제시 용지면 황토로 755,35.8543806,126.9553011
전북 김제시 용지면 금백로 996,35.8577073,126.9910605
전북 김제시 용지로 3 ,35.819431,126.9445426
전북 김제시 금산면 금평로 258,35.7207413,126.9914826
전북 김제시 진남길 7,35.7974783,126.8651891
전북 김제시 만경읍 만경로 927,35.8625585,126.8183132
전북 김제시 봉황로 1294 ,35.7825515,126.9185271
전북 김제시 벽골제로 637 ,35.7691854,126.8627434
전북 김제시 하공로 203,35.8261278,126.8977732
전북 김제시 벽골제로 754 ,35.7780403,126.8696063
전북 김제시 콩쥐팥쥐로 155 ,35.8120734,126.9196472
전북 김제시 봉남면 봉남로 507,35.7597291,126.9558842
전북 김제시 진봉면 해학로 791,35.8350785,126.8107075
전라북도 김제시 지평선로 1787,35.85711,126.7688217
전북 김제시 용지면 콩쥐팥쥐로 717,35.81538219999999,126.9792647
전북 김제시 청하면 만경로 1470,35.9065041,126.8400934
전북 김제시 금구면 선비로 1038,35.7858982,127.0291268
전북 김제시 금구면 봉두4길 58,35.7759967,127.0073037
전북 김제시 콩쥐팥쥐로 80,35.807427,126.9139157
전북 김제시 백구면 번영로 2668,35.8813191,126.9784581
전북 김제시 백구면 번영1길 3,35.9086141,126.9417819
전북 김제시 벽성로 362 ,35.8052007,126.8742182
전북 김제시 금구면 선비로 1311,35.7916301,127.0537262
전북 김제시 만경로 54 ,35.8112187,126.8708757
전북 김제시 봉남면 봉남로 115,35.7371253,126.9860206
전북 김제시 황산면 용마로 296,35.80035670000001,126.966402
전북 김제시 벽성로 453 ,35.8098103,126.8820909
전북 김제시 백구면 번영로 2773,35.8784082,126.9887193
전북 남원시 낙현안길 4,35.4233283,127.4082203
전북 남원시 요천로 1325,35.3975488,127.3685477
전북 남원시 춘향로 152 ,35.4263904,127.3885229
전북 남원시 유천길 24 ,35.4151921,127.3766199
전북 남원시 보절면 보산로 949,35.5136949,127.3996435
전북 남원시 대산면 운교2길 20,35.43023790000001,127.3252913
전라북도 남원시  남문로 202,35.4043206,127.3538292
전북 남원시 요천로 1844 ,35.4220847,127.3989478
전북 남원시 서문로 56,35.7289376,126.7239279
전북 남원시 산업로 3272,35.4172724,127.4172289
전북 남원시 노송로 1252 ,35.39536,127.3782158
전북 남원시 사매면 춘향로 999,35.4933579,127.3548773
전북 남원시 아영면 88올림픽고속도로 76,35.5086445,127.6131763
전북 남원시 아영면 광주대구고속도로 75-1,35.5086445,127.6131763
전북 남원시 운봉읍 황산로 1055,35.4373064,127.5280059
전북 남원시 원천로 45 ,35.4095193,127.3969543
전북 남원시 요천로 1780 ,35.4218854,127.4075217
전북 남원시 주생면 요천로 974,35.3864831,127.3345583
전북 남원시 충정로 84 ,35.4137213,127.3844125
전북 남원시 송동면 주송길 25,35.3758736,127.3370716
전북 남원시 춘향로 300,35.4354245,127.3785379
전북 남원시 덕과면 덕오로 245,35.5105991,127.3582296
전북 남원시 아영면 인월장터로 241,35.4800698,127.5909796
전북 남원시 동림로 82 ,35.4157776,127.386402
전북 남원시 요천로 1931 ,35.4337611,127.4143589
전북 남원시 춘향로 824,35.4803606,127.3641419
전북 남원시 춘향로 370,35.4412835,127.3760928
전북 남원시 남문로 359 ,35.4070377,127.3707957
전북 남원시 요천로 2226,35.4543603,127.4328471
전북 남원시 주천면 원천로 168-14,35.4078553,127.4112004
전북 남원시 충정로 245 ,35.4214398,127.3945969
전북 남원시 운봉읍 운성로 26,35.4361991,127.5297503
전북 남원시 운봉읍 황산로 1026,35.436999,127.525024
전북 남원시 춘향로 214,35.4293483,127.3829391
전북 남원시 산내면 천왕봉로 525,35.4309544,127.6165927
전북 남원시 인월면 인월장터로 147,35.4648432,127.5998807
전북 남원시 인월면 천왕봉로 304,35.4413456,127.6084619
전북 남원시 아영면 아백로 371,35.507925,127.6119466
전북 남원시 인월면 천왕봉로 45,35.4615626,127.6058774
전북 남원시 천왕봉로 591,35.4279797,127.6219986
전북 남원시 춘향로 95 ,35.4228086,127.3919615
전북 남원시 금지면 요천로 266,35.33334540000001,127.2997717
전북 남원시 대강면 섬진로 816,35.34300520000001,127.2296114
전북 남원시 요천로 1754 ,35.4198052,127.4055515
전북 남원시 조산길 3 ,35.3993687,127.3732068
전북 남원시 주천면 원천로 404,35.3988622,127.4330632
전북 남원시 아영면 아백로 346,35.5054822,127.6116299
전북 무주군 안성면 안성로 29,35.845433,127.6517587
전북 무주군 무주읍 무금로 43,35.9816712,127.6462419
전북 무주군 무주읍 무학로 26,36.0128135,127.6770308
전북 무주군 설천면 무설로 1567,36.0106363,127.7864013
전북 무주군 적상면 적상산로 124,35.9514917,127.6622171
전북 무주군 무주읍 무금로 269,35.9904861,127.6246227
전북 무주군 무풍면 현내로 428,35.9642813,127.8632775
전북 무주군 안성면 통영대전고속도로 148,35.8634668,127.6530934
전북 무주군 적상면 치마재로 447,35.9306362,127.7143199
전북 무주군 설천면 무설로 1704,35.9998757,127.7921094
전라 무주군 부남면 부남로 866-2,35.9722779,127.5596593
전북 무주군 적상면 적상산로 8,35.9415789,127.6593055
전북 무주군 무주읍 한풍루로 280,36.0024523,127.6570062
전북 무주군 적상면 괴목로 935,35.9772854,127.7023414
전북 무주군 무풍면 현내로 178,35.9692099,127.8448735
전북 무주군 무주읍 단천로 58,36.0073639,127.6574331
전북 무주군 무풍면 구천동로 412,35.8924397,127.8202345
전북 무주군 무주읍 무설로 99,36.0107514,127.6859061
전북 무주군 무주읍 무학로 171,36.0251662,127.6731558
전북 무주군 안성면 안성로 446,35.8701913,127.6698755
전북 무주군 안성면 안성로 256,35.8643264,127.6529461
전북 무주군 적상면 치마재로 165,35.9201179,127.6865275
전북 무주군 무주읍 무금로 359,35.9891507,127.6150481
전북 무주군 안성면 장무로 1371,35.8142482,127.6310555
전북 무주군 무주읍 무설로 491,36.0308726,127.7142037
전북 무주군 적상면 치마재로 62,35.9157185,127.6827532
전북 무주군 무주읍 주계로 75,36.0063575,127.6585068
전북 부안군 변산면 격포로 23,35.6358785,126.4841604
전북 부안군 계화면 간재로 381,35.7608546,126.7006107
전북 부안군 진서면 청자로 1260,35.6084861,126.6280919
전북 부안군 부안읍 번영로 53,35.7268217,126.7260893
전북 부안군 보안면 부안로 1355,35.6295388,126.6676412
전북 부안군 보안면 부안로 1201,35.6157161,126.6689003
전북 부안군 진서면 내소사로 41,35.6005323,126.5814771
전북 부안군 하서면 변산로 437 ,35.723557,126.6776925
전북 부안군 변산면 변산로 2407,35.66076,126.5117906
전북 부안군 주산면 서해안고속도로 103,35.6718779,126.711077
전북 부안군 주산면 서해안고속도로 106,35.6718779,126.711077
전북 부안군 동진면 간재로 179,35.7524731,126.7190511
전북 부안군 부안읍 석정로 87,35.7377417,126.7352355
전북 부안군 동진면 간재로 262,35.7539658,126.7105433
전북 부안군 부안읍 매창로 74,35.7180346,126.7270581
전북 부안군 백산면 부평로 214-20,35.7052184,126.7810449
전북 부안군 부안읍 봉두길 75,35.7169463,126.7452996
전북 부안군 동진면 동진로 117,35.7514755,126.7407366
전라북도 부안군 백산면 백산로 325,35.7033393,126.7867631
전북 부안군 주산면 선돌로 332,35.6749094,126.7142983
전북 부안군 부안읍 오리정로 56,35.7233352,126.7345719
전북 부안군 하서면 변산로 945,35.7114682,126.6288067
전북 부안군 부안읍 석정로 169,35.7306026,126.7370307
전북 부안군 행안면 변산로 156,35.7301353,126.7043541
전북 부안군 변산면 변산로 3214,35.600038,126.4847561
전북 부안군 상서면 부안로 1771,35.6661287,126.6727358
전북 부안군 동진면 부령로 71,35.7346207,126.7493855
전북 부안군 줄포면 부안로 991,35.5844872,126.6846566
전북 부안군 보안면 부안로 1137,35.6100807,126.6684418
전북 부안군 부안읍 석정로 116,35.7351658,126.7352287
전북 부안군 줄포면 부안로 564,35.5701128,126.6985684
전북 부안군 줄포면 부안로 908,35.590037,126.6747565
전북 부안군 행안면 번영로 27,35.7256592,126.7236298
전북 부안군 줄포면 부안로 1025,35.6004164,126.6727182
전북 부안군 줄포면 주을로 66,35.5978696,126.6844068
전북 부안군 변산면 지서로 23,35.6681805,126.5307546
전북 부안군 변산면 격포로 177,35.62615210000001,126.4729664
전북 부안군 하서면 변산로 710,35.7126306,126.6540968
전북 부안군 행안면 서문로 72-1,35.7290919,126.7222453
전북 부안군 행안면 부안로 2400,35.7098513,126.7109183
전북 부안군 부안읍 부령로 2,35.7299186,126.7447005
전북 순창군 순창읍 장류로 73,35.369535,127.1144196
전북 순창군 순창읍 광주대구고속도로 27,35.3769309,127.1470514
전북 순창군 순창읍 광주대구고속도로 28,35.3769309,127.1470514
전북 순창군 순창읍 순창로 269,35.3790127,127.1435212
전북 순창군 구림면 구림로 449,35.4512086,127.0999104
전북 순창군 동계면 동계1길 35,35.4428772,127.2440716
전북 순창군 순창읍 담순로 1440,35.3771578,127.1533842
전북 순창군 복흥면 가인로 656,35.4485842,126.9918328
전북 순창군 금과면 금풍로 188,35.3385009,127.0857505
전북 순창군 복흥면 추령로 1181-1,35.4337462,126.92821
전북 순창군 쌍치면 쌍계로 22,35.4995887,127.0010574
전북 순창군 인계면 인덕로 174,35.4074051,127.1406282
전북 순창군 순창읍 장류로 339,35.376986,127.1394045
전북 순창군 순창읍 남산길 4,35.3661104,127.140857
전북 순창군 순창읍 장류로 320,35.3766318,127.1373877
전북 순창군 순창읍 인덕로 63,35.3977897,127.139669
전북 순창군 복흥면 추령로 1131,35.4300091,126.9308442
전북 순창군 복흥면 추령로 1727,35.472601,126.9260496
전북 완주군 봉동읍 과학로 755,35.9359099,127.1249889
전북 완주군 구이면 구이로 731,35.6672168,127.1133531
전북 완주군 콩쥐팥쥐로 904,35.818766,126.9989234
전북 완주군 상관면 춘향로 4073,35.7307045,127.2298932
전북 완주군 상관면 춘향로 3931,35.7050657,127.243062
전북 완주군 고산면 고산천로 582,35.9756316,127.2000599
전북 완주군 고산면 고산로 13,35.9767147,127.1986539
전북 완주군 이서면 이서로 92,35.8206469,127.0268956
전북 완주군 용진면 하이1길 1,35.8618364,127.1745726
전북 완주군 봉동읍 봉동로 516,35.9583606,127.1368791
전북 완주군 구이면 구이로 1488,35.73218840000001,127.1204444
전북 완주군 봉동읍 삼봉로 915,35.9404621,127.1642885
