주소,위도,경도
강원도 강릉시 사임당로 178,37.766299,128.8611138
강원 강릉시 구정면 칠성로 187,37.7069631,128.904158
강원 강릉시 연곡면 동해대로 4091,37.8565063,128.8394624
강원 강릉시 사천면 동해대로 3576,37.805104,128.8611672
강원 강릉시 범일로 475 ,37.7302727,128.8785089
강원 강릉시 동해대로 3970,37.8374023,128.8443841
강원 강릉시 입암로 47 ,37.7512832,128.9124838
강원 강릉시 동해대로 3292,37.751853,128.8760574
강원 강릉시 교동하슬라로 233,37.7706468,128.8754404
강원 강릉시 성산면 영동고속도로 232-1,37.7187293,128.8320709
강원 강릉시 영동고속도로 231-1,37.751853,128.8760574
강원 강릉시 경강로 2224 ,37.7627776,128.906864
강원 강릉시 주문진읍 신리천로 95,37.881991,128.821099
강원 강릉시 강릉대로 432 ,37.7718543,128.9115459
강원 강릉시 하슬라로 159 ,37.7643418,128.8744218
강원 강릉시 동해대로3305번길 7 ,37.7853101,128.8722461
강원 강릉시 성산면 구산길 16,37.7190386,128.8323391
강원 강릉시 유산로 19 ,37.7379663,128.9152402
강원 강릉시 경강로 1932 ,37.74754,128.8810324
강원 강릉시 경강로 2101,37.7552848,128.896491
강원 강릉시 입암로 12 ,37.7481627,128.9114696
강원 강릉시 동해대로 3433 ,37.792728,128.8622384
강원 강릉시 안현로 40 ,37.8004224,128.864843
강원 강릉시 성산면 구산길 44,37.7168719,128.8312827
강원 강릉시 주문진읍 동해대로 4730,37.898107,128.8211245
강원 강릉시 경강로 2225,37.7633182,128.9066221
강원 강릉시 사천면 구라미등길 3,37.8436549,128.8401617
강원 강릉시 구정면 동해고속도로 345-1,37.7181403,128.8796923
강원 강릉시 구정면 동해고속도로 346,37.7181403,128.8796923
강원 강릉시 경강로1804번길 8 ,37.7453079,128.8668451
강원 강릉시 경강로 1843 ,37.7465398,128.8712246
강원 강릉시 동해대로 2336,37.7291084,128.9329581
강원 강릉시 남부로 136 ,37.7420619,128.8953614
강원 강릉시 경강로 1889 ,37.7473353,128.876339
강원 강릉시 남부로 67 ,37.7407188,128.8878216
강원 강릉시 가작로 308 ,37.7707566,128.9092486
강원 강릉시 남구길 31,37.7654636,128.9044986
강원 강릉시 강동면 율곡로 2170,37.7274338,128.9582831
강원 강릉시 경강로 2344,37.7690098,128.9172304
강원 강릉시 옥가로 37 ,37.7597196,128.8994499
강원 강릉시 사천면 동해대로 3937,37.8346178,128.8454487
강원 강릉시 주문진읍 신영길 43,37.9056781,128.8167294
강원 강릉시 연곡면 동해대로 4069,37.8459918,128.8400746
강원 강릉시 사임당로 31 ,37.7484202,128.8621586
강원 강릉시 사천면 동해대로 3739,37.8178033,128.8516888
강원 강릉시 사천면 동해대로 3662,37.8118868,128.8569587
강원 강릉시 임영로 242 ,37.7626139,128.8924233
강원 강릉시 연곡면 삼산리 진고개로1515,37.8470774,128.7058382
강원 강릉시 공제로437번길 1 ,37.746133,128.8676161
강원 강릉시 경강로 2395 ,37.7720298,128.9219908
강원 강릉시 범일로 596 ,37.74081049999999,128.8804035
강원 강릉시 경강로 2578 ,37.7733083,128.9413693
강원 강릉시 연곡면 진고개로 2720,37.8590717,128.8363967
강원 강릉시 연곡면 동해대로 4276,37.8633598,128.8383942
강원 강릉시 옥계면 동해고속도로 322,37.6126866,129.0379266
강원 강릉시 옥계면 동해대로 321,37.6164437,129.0469492
강원 강릉시 옥계면 현내시장길 14,37.6131626,129.0383369
강원 강릉시 왕산면 백두대간로 1986,37.67174929999999,128.8386562
강원 강릉시 율곡로 2573 ,37.7412665,128.9192219
강원 강릉시 구정면 범일로 23,37.7097393,128.9129121
강원 강릉시 강릉대로 308 ,37.7637118,128.902179
강원 강릉시 강동면 율곡로 2202,37.7277547,128.9547161
강원 강릉시 성덕포남로 97 ,37.7625269,128.91528
강원 강릉시 강동면 헌화로 1073,37.6887663,129.0323016
강원 강릉시 화부산로141번안길 6-6,37.7664138,128.894874
강원 강릉시 주문진읍 동해대로 4623,37.8885719,128.8196759
강원 강릉시 주문진읍 동해대로 4785,37.9023271,128.8176646
강원 강릉시 동해대로 3373,37.7897014,128.8677665
강원 강릉시 연곡면 동해대로 4094,37.84729830000001,128.8428482
강원 강릉시 경강로 2228 ,37.7629346,128.907068
강원 강릉시 강릉대로 489 ,37.77649,128.9152637
강원 강릉시 강동면 동해대로 1891,37.7171162,128.9784849
강원 강릉시 주문진읍 주문북로 106,37.9024532,128.8251572
강원 강릉시 성덕로 81 ,37.7665716,128.9424768
강원 강릉시 해안로 321 ,37.7929954,128.9176029
강원 강릉시 연곡면 진고개로 2283-3,37.8534629,128.7907649
강원 강릉시 경강로 1935 ,37.7479926,128.8814667
강원 강릉시 율곡로 2636 ,37.7452707,128.9142244
강원 강릉시 연곡면 동해대로 4357,37.8699049,128.8343096
강원 강릉시 가작로 227,37.7712208,128.8999433
강원 강릉시 강릉대로 161 ,37.7574671,128.88815
강원 강릉시 경강로 1850 ,37.7459739,128.8723198
강원 강릉시 명륜로 45,37.7651567,128.8983647
강원 강릉시 관솔길 27 ,37.7393119,128.8701052
강원 고성군 간성읍 탑동길 4-15,38.377689,128.4759418
강원 고성군 현내면 금강산로 49,38.48386110000001,128.4276234
강원 고성군 거진읍 거탄진로 0,38.4436442,128.4530379
강원 고성군 거진읍 거탄진로 44,38.4391509,128.4520401
강원 고성군 죽왕면 동해대로 6176,38.3499716,128.5097954
강원 고성군 간성읍 간성로 32,38.3791364,128.4715768
강원도 고성군 토성면 청간정길 6-2,38.2656697,128.555622
강원 고성군 거진읍 진부령로 2875,38.3879103,128.4589519
강원 고성군 토성면 미시령로 2635,38.2069023,128.4944877
강원 고성군 거진읍 거탄진로 84,38.4427486,128.4535965
강원 고성군 토성면 미시령로 2699,38.2066209,128.501572
강원 고성군 토성면 동해대로 5439,38.2913301,128.5446101
강원 고성군 토성면 동해대로 5210,38.2717076,128.5488018
강원 고성군 토성면 중앙로 511,38.2307761,128.5800965
강원 고성군 토성면 동해대로 4567,38.2218899,128.5638349
강원 고성군 토성면 동해대로 5199,38.2704292,128.5491636
강원 고성군 현내면 금강산로 474,38.5146032,128.4189127
강원 고성군 간성읍 진부령로 1818,38.3243006,128.3894987
강원 동해시 효자로 723 ,37.4927191,129.1134416
강원 동해시 동해대로 5361 ,37.5311952,129.1068506
강원 동해시 동해대로 4985,37.5311952,129.1068506
강원 동해시 강원남부로 4591 ,37.4605183,129.1150946
강원 동해시 동해대로 4912 ,37.5311952,129.1068506
강원 동해시 동해대로 5133 ,37.5311952,129.1068506
강원 동해시 해안로 63 ,37.5098452,129.1249423
강원 동해시 동해대로 6121,37.5311952,129.1068506
강원 동해시 공단1로 7-13 ,37.4714169,129.1409009
강원 동해시 강원남부로 4650 ,37.4656145,129.115488
강원 동해시 동해대로 4683,37.5311952,129.1068506
강원 동해시 대동로 263 ,37.4929244,129.1243967
강원도 동해시  동해대로 5480 ,37.5311952,129.1068506
강원 동해시 동해대로 5161 ,37.5311952,129.1068506
강원 동해시 동해대로 6036 ,37.5311952,129.1068506
강원 동해시 동해대로 5050 ,37.5311952,129.1068506
강원 동해시 대동로 249 ,37.4878765,129.127786
강원 동해시 동해대로 4772 ,37.5311952,129.1068506
강원 동해시 동해대로 6124 ,37.5311952,129.1068506
강원 동해시 발한로 39 ,37.5361084,129.1028983
강원도 동해시 해안로 595 ,37.5529463,129.104208
강원 동해시 대동로 261-28 ,37.4928905,129.121706
강원 동해시 효자로 636,37.4911753,129.1040714
강원 동해시 동해대로 5155 ,37.5311952,129.1068506
강원 동해시 발한로 369 ,37.5607899,129.1018857
강원 동해시 용정로 55 ,37.49953319999999,129.1182204
강원 동해시 효자로 400 ,37.4821264,129.0816302
강원 동해시 효자로 576 ,37.4881902,129.0981679
강원 동해시 용정로 169 ,37.5029714,129.1261511
강원 동해시 동해대로 5090,37.5311952,129.1068506
강원 동해시 해안로 197 ,37.5209276,129.1197635
강원 동해시 동해대로 6427 ,37.5311952,129.1068506
강원 동해시 효자로 277 ,37.4884923,129.0706551
강원 동해시 발한로 384 ,37.5622958,129.1013669
강원도 삼척시 근덕면 삼척로 2771,37.3408159,129.2588691
강원 삼척시 동해대로 4011 ,37.4396019,129.1799108
강원 삼척시 동해대로 4323 ,37.4575965,129.161
강원 삼척시 근덕면 삼척로 3559,37.3408159,129.2588691
강원 삼척시 오십천로 457 ,37.43973829999999,129.168363
강원 삼척시 원덕읍 삼척로 865,37.2143082,129.3356287
강원 삼척시 신기면 강원남부로 2620,37.3215618,129.076601
강원 삼척시 미로면 강원남부로 3967,37.41314819999999,129.1111872
강원 삼척시 근덕면 삼척로 3071,37.3408159,129.2588691
강원 삼척시 도계읍 강원남부로 1818,37.2383019,129.0460044
강원 삼척시 도계읍 강원남부로 1560,37.2429616,129.0467975
강원 삼척시 오십천로 101 ,37.4433216,129.1321782
강원 삼척시 근덕면 삼척로 3393,37.3408159,129.2588691
강원 삼척시 미로면 강원남부로 3593,37.3914745,129.1020225
강원 삼척시 근덕면 삼척로 3840,37.3408159,129.2588691
강원 삼척시 동해대로 4298 ,37.4575228,129.164921
강원 삼척시 하장면 백두대간로 2689,37.3664006,128.9204602
강원 삼척시 노곡면 문의재로 2546,37.2724543,129.1786626
강원 삼척시 교동로 40 ,37.4476622,129.1668848
강원 삼척시 동해대로 4190,37.4543285,129.1760247
강원 삼척시 신기면 강원남부로 3038,37.3529275,129.085424
강원 삼척시 동해대로 4088 ,37.4455673,129.1787772
강원 삼척시 도계읍 강원남부로 1696,37.2523019,129.0546517
강원 삼척시 동해대로 3852 ,37.4295436,129.1828895
강원 삼척시 원덕읍 가곡천로 3021,37.1659138,129.3289807
강원 삼척시 원덕읍 삼척로 437-9,37.1757176,129.3353773
강원 삼척시 원덕읍 삼척로 1203,37.2319327,129.3424252
강원 삼척시 근덕면 삼척로 2158,37.3408159,129.2588691
강원 삼척시 도계읍 강원남부로 1332,37.2235525,129.0415567
강원 삼척시 하장면 백두대간로 2564,37.3501728,128.938163
강원 삼척시 원덕읍 삼척로 324,37.1677294,129.3399443
강원 속초시 동해대로 4043 ,38.1893245,128.5925827
강원 속초시 동해대로 4168 ,38.1914851,128.5799309
강원 속초시 동해대로 3834 ,38.17731,128.60322
강원 속초시 동해대로 4122 ,38.1899484,128.583485
강원 속초시 설악산로 35 ,38.1618568,128.60388
강원 속초시 설악산로 441 ,38.1643511,128.5592091
강원 속초시 설악산로 74 ,38.1612953,128.5997
강원 속초시 장안로 21 ,38.2114658,128.5918316
강원 속초시 번영로 178 ,38.2146034,128.5899625
강원 속초시 온천로 269 ,38.1930932,128.5718633
강원 속초시 동해대로 4232 ,38.1966878,128.5785348
강원 속초시 온천로 3,38.189715,128.5427316
강원 속초시 동해대로 4198 ,38.1939417,128.5781694
강원 속초시 중앙로 355 ,38.2199481,128.5908199
강원 속초시 온천로 118 ,38.1892802,128.5557581
강원 속초시 미시령로 3271 ,38.2048148,128.5653497
강원 속초시 온천로 303 ,38.193166,128.5757693
강원 속초시 온천로 161 ,38.1915353,128.559184
강원 속초시 원암학사평길 50 ,38.2070871,128.5137723
강원 속초시 동해대로 4446 ,38.21104529999999,128.564522
강원 속초시 동해대로 3885 ,38.1815364,128.6011169
강원도 속초시  관광로 486 ,38.2026031,128.5339363
강원 양구군 국토정중앙면 춘양로 3592,38.1266922,128.046404
강원 양구군 국토정중앙면 정중앙로 352,38.08809129999999,128.024812
강원도 양구군 양구읍 중심로 165 ,38.1052331,127.9905017
강원 양구군 양구읍 중심로 7,38.0916861,127.9959848
강원 양구군 해안면 해안서화로 22-4,38.2894394,128.1427594
강원 양구군 동면 금강산로 1696,38.2023743,128.0449094
강원 양구군 양구읍 춘양로 2641,38.0643962,127.9869639
강원 양구군 국토정중앙면 정중앙로 584-1,38.1061663,128.0313542
강원 양구군 방산면 평화로 5181,38.2080172,127.9509229
강원 양구군 양구읍 양구새싹로 12,38.10174050000001,127.9867098
강원 양양군 강현면 동해대로 3081,38.117119,128.6286111
강원 양양군 양양읍 동해대로 2643,38.0804872,128.6282461
강원 양양군 손양면 동해대로 1750,38.0377393,128.6958827
강원 양양군 강현면 동해대로 3343,38.1366621,128.6168695
강원 양양군 강현면 동해대로 3415,38.142196,128.6123631
강원 양양군 현남면 동해대로 376,37.94269630000001,128.7828049
강원도 양양군 현북면 동해대로 1252,38.0045675,128.7319908
강원 양양군 서면 구룡령로 2948,37.9612452,128.525577
강원 양양군 현남면 동해대로 603,37.9588515,128.7665919
강원 양양군 손양면 동해대로 2519,38.07192939999999,128.63567
강원 양양군 손양면 동해대로 2041,38.0428043,128.6673451
강원 양양군 양양읍 설악로 2728,38.0758377,128.5005763
강원 양양군 양양읍 동해대로 2662,38.08161680000001,128.6298037
강원 양양군 양양읍 동해대로 3039,38.1136542,128.6307287
강원 양양군 양양읍 양양로 98,38.0739728,128.618629
강원 양양군 손양면 동해대로 2181,38.0472995,128.652873
강원 양양군 현남면 화상천로 5-4,37.92858349999999,128.7914959
강원 양양군 양양읍 동해대로 2853,38.0989463,128.6289423
강원 영월군 김삿갓면 영월동로 1139,37.1288152,128.5367874
강원 영월군 영월읍 영월로 2153,37.1850793,128.4850458
강원 영월군 영월읍 청령포로 6,37.1851613,128.4574144
강원 영월군 주천면 송학주천로 1002,37.2422214,128.2448475
강원 영월군 김삿갓면 영월동로 2150,37.1213553,128.6109676
강원 영월군 중동면 태백산로 1308,37.1390426,128.6888658
강원 영월군 한반도면 강원남로 140,37.1797452,128.3107208
강원 영월군 북면 원동재로 513,37.2521703,128.4302405
강원 영월군 중동면 영월로 3730,37.1965424,128.6058236
강원 영월군 한반도면 서강로 781,37.236355,128.3315384
강원 영월군 한반도면 강원남로 153,37.1802291,128.3120968
강원 영월군 영월읍 영월로 2275,37.18284939999999,128.4975598
강원 영월군 영월읍 영월로 3206-8,37.190673,128.5686377
강원 영월군 영월읍 하송로 156,37.1760685,128.4563585
강원 영월군 영월읍 영월로 1850,37.1861408,128.4569416
강원 영월군 한반도면 강원남로 267,37.1737721,128.3216861
강원 영월군 북면 원동재로 98,37.2199066,128.4194564
강원 영월군 상동읍 태백산로 3234,37.129239,128.8305108
강원 영월군 주천면 송학주천로 1462,37.2674664,128.2804597
강원 영월군 한반도면 강원남로 130,37.1798185,128.3092255
강원 영월군 남면 강원남로 641,37.1771249,128.3552327
강원 영월군 남면 영월로 971,37.19886,128.4031017
강원 영월군 주천면 송학주천로 1367,37.2658381,128.2668895
강원 영월군 영월읍 중앙로 254,37.1696876,128.4785234
강원 영월군 상동읍 태백산로 2317-1,37.1209623,128.7452238
강원도 원주시 문막읍 원문로 1468 ,37.3247788,127.8412813
강원 원주시 문막읍 원문로 1449,37.3249593,127.8434779
강원 원주시 북원로 2664 ,37.381307,127.9470842
강원 원주시 치악로 1733 ,37.33706550000001,127.9560251
강원 원주시 문막읍 원문로 1342,37.330694,127.8491014
강원 원주시 귀래면 고청길 70,37.2279009,127.8679322
강원 원주시 신림면 신림황둔로 833,37.248921,128.1547687
강원 원주시 북원로 2563,37.373147,127.9422349
강원 원주시 문막읍 왕건로 161,37.3335156,127.8340196
강원도 원주시  서원대로 51 ,37.3523127,127.92331
강원 원주시 흥업면 원문로 898,37.3434879,127.8824656
강원 원주시 북원로 2151,37.3380985,127.9304006
강원 원주시 호저면 원문로 545,37.35844,127.9034008
강원 원주시 소초면 북원로 3064,37.4147724,127.9623344
강원 원주시 북원로 2509 ,37.3683829,127.9404513
강원 원주시 북원로 2732 ,37.3872801,127.9485978
강원 원주시 문막읍 원문로 1734-18,37.314843,127.8233557
강원 원주시 문막읍 원문로 1640,37.3183356,127.8300641
강원 원주시 호저면 원문로 402,37.3617075,127.9139723
강원 원주시 판부면 용수골길 230,37.2926721,127.9394474
강원 원주시 평원로 111 ,37.3538911,127.9474602
강원 원주시 강변로 283 ,37.3329707,127.9607559
강원 원주시 행구로 50,37.341271,127.9614299
강원 원주시 현충로 288 ,37.3790849,127.9491793
강원 원주시 치악로 1371 ,37.3097667,127.9761851
강원 원주시 행구로 121 ,37.3422826,127.9695362
강원 원주시 귀래면 북원로 116-1,37.1709956,127.8843919
강원 원주시 판부면 남원로 380,37.3193651,127.9399101
강원 원주시 흥업면 사제로 5,37.3028174,127.9192644
강원 원주시 귀래면 북원로 105,37.1699065,127.8838373
강원 원주시 판부면 치악로 991,37.28263020000001,128.0000158
강원 원주시 동부순환로 69,37.3216942,127.9737802
강원 원주시 호저면 원문로 437,37.3609413,127.9112288
강원 원주시 서원대로 154 ,37.3440951,127.9284221
강원 원주시 치악로 1464 ,37.3164336,127.9703082
강원 원주시 원문로 246 ,37.3562961,127.9241763
강원 원주시 호저면 마근거리길 120,37.4336254,127.9294805
강원 원주시 북원로 2607 ,37.4225865,127.9659584
강원 원주시 흥업면 원문로 804,37.3429669,127.8861684
강원 원주시 문막읍 원문로 1387,37.3282336,127.8467107
강원 원주시 치악로 2090 ,37.365476,127.9624335
강원 원주시 문막읍 원문로 1895,37.3064038,127.8149126
강원 원주시 현충로 40,37.3593485,127.9547275
강원 원주시 문막읍 보통로 153,37.3398361,127.8529339
강원 원주시 원문로 347 ,37.3598209,127.9182269
강원 원주시 남원로 629 ,37.3392914,127.9519023
강원 원주시 소초면 치악로 2324,37.382684,127.9749763
강원 원주시 문막읍 여원로 1479,37.2788298,127.7744572
강원 원주시 문막읍 원문로 1234-1,37.3357884,127.8581985
강원 원주시 문막읍 문막시장1길 19,37.3073311,127.8172737
강원 원주시 문막읍 원문로 2075,37.3025455,127.8089145
강원 원주시 부론면 법천시장길 7,37.2107331,127.7502295
강원 원주시 문막읍 원문로 2170,37.297802,127.7947974
강원 원주시 소초면 북원로 3370,37.437612,127.9784658
강원 원주시 판부면 남원로 174,37.3073176,127.9275873
강원 원주시 판부면 치악로 1125,37.292107,127.9918906
강원 원주시 지정면 원문로 1035,37.3378784,127.8735914
강원 원주시 소초면 치악로 2834,37.4210977,128.003751
강원 원주시 소초면 치악로 2574,37.4007948,127.9907302
강원도 원주시 신림면 신림황둔로 99 ,37.2375486,128.0870294
강원 원주시 신림면 제원로 1429,37.2284021,128.0820672
강원 원주시 북원로 2400,37.3588645,127.9386504
강원 원주시 호저면 신무로 12,37.3572639,127.9010317
강원 원주시 강변로 577 ,37.3548318,127.9517355
강원 원주시 지정면 지정로 819,37.3509633,127.8030259
강원 원주시 문막읍 원문로 1227,37.3338184,127.8580329
강원 원주시 우산로 2 ,37.3652583,127.9360982
강원 원주시 원문로 149 ,37.3553152,127.9323082
강원 원주시 소초면 치악로 2327,37.3832102,127.9746622
강원 원주시 호저로 226 ,37.3876685,127.9396267
강원 원주시 원문로 192 ,37.3562862,127.9285596
강원도 원주시 치악로 1563 ,37.3226508,127.9621694
강원 원주시 북원로 2820 ,37.3948794,127.9513732
강원 원주시 지정면 월송석화로 446,37.4036278,127.840314
강원 원주시 봉화로 87 ,37.3523662,127.9281784
강원 원주시 치악로 2215 ,37.3742051,127.9691293
강원 원주시 한지공원길 42 ,37.3306645,127.9424333
강원 원주시 강변로 745 ,37.3698448,127.946749
강원도 원주시 북원로 2109 ,37.3347741,127.928501
강원 원주시 치악로 1263 ,37.3013819,127.9813766
강원 원주시 북원로 1930 ,37.3215753,127.9196878
강원 원주시 서원대로 421,37.3298521,127.9514603
강원 원주시 시청로 170,37.3290948,127.9395267
강원 원주시 지정면 간현로 110,37.3613475,127.8412845
강원 원주시 문막읍 원문로 1320,37.3316195,127.8505282
강원 원주시 치악로 1974 ,37.3566794,127.9570488
강원 원주시 신림면 치악로 416,37.2537638,128.0484301
강원 원주시 신림면 다리실2길 32,37.2568971,128.0482991
강원 원주시 신림면 신림황둔로 1107,37.2575546,128.1790809
강원 원주시 북원로 2705 ,37.3849439,127.9473572
강원 원주시 호저면 호저로 598,37.4248376,127.921843
강원 원주시 강변로 629,37.3595329,127.949521
강원도 원주시 문막읍 개나루길 13,37.2979848,127.8173143
강원 원주시 호저면 마근거리길 110,37.4353657,127.9315129
강원 원주시 북원로 2564 ,37.3729672,127.9430005
강원 원주시 강변로 685 ,37.3647815,127.9487464
강원 원주시 북원로 2740,37.3880281,127.9487689
강원 원주시 행구로 253 ,37.3431496,127.9838989
강원 원주시 지정면 기업도시로 125,37.3716767,127.8702109
강원 원주시 북원로 2929 ,37.4046854,127.9542518
강원 원주시 서원대로 516 ,37.3243017,127.9597562
강원 원주시 남원로 505 ,37.3296142,127.9452958
강원 원주시 천사로 235 ,37.35268720000001,127.9496136
강원 원주시 현충로 24 ,37.3580023,127.9548863
강원 원주시 소초면 치악로 2348,37.38441,127.9765804
강원 원주시 흥업면 남원로 133,37.3068187,127.9224865
강원 원주시 지정면 원문로 1153,37.3352392,127.863938
강원 인제군 북면 미시령로 660,38.1809531,128.3086722
강원 인제군 북면 미시령로 951,38.1809531,128.3086722
강원 인제군 기린면 내린천로 3996,37.9529822,128.316027
강원 인제군 상남면 서울양양고속도로 117,37.8740954,128.2599315
강원 인제군 인제읍 광치령로 681,38.1345247,128.1559575
강원 인제군 북면 원통로 142,38.1200357,128.2016807
강원 인제군 북면 미시령로 979,38.1809531,128.3086722
강원 인제군 북면 고원통로 121,38.1505273,128.2572656
강원 인제군 북면 미시령로 1113-3,38.1809531,128.3086722
강원 인제군 인제읍 인제로 146,38.06601860000001,128.1678728
강원 인제군 상남면 아홉사리로 3171,37.8666653,128.2602161
강원 인제군 남면 설악로 233,37.968761,128.0887947
강원 인제군 남면 신남로 79,37.9698574,128.0807971
강원 인제군 남면 설악로 51,37.968761,128.0887947
강원 인제군 기린면 내린천로 3477,37.93263049999999,128.2936125
강원 인제군 기린면 상하답로 130,38.0090727,128.3155273
강원 인제군 인제읍 인제로 245,38.0715478,128.1766193
강원 인제군 남면 설악로 160,37.968761,128.0887947
강원 인제군 북면 설악로 2775,38.1147733,128.2020517
강원 인제군 기린면 내린천로 4172,37.968029,128.3230159
강원 인제군 서화면 금강로 1378,38.2197261,128.2054674
강원 인제군 북면 원통로 331,38.1293728,128.2187406
강원 인제군 북면 설악로 3251-7,38.1394251,128.2447419
강원 인제군 남면 신남로 151,37.9745433,128.0863363
강원 인제군 인제읍 설악로 2352,38.0855358,128.1824541
강원 정선군 정선읍 비봉로 71,37.381671,128.6661746
강원 정선군 고한읍 고한로 209,37.1974583,128.8572195
강원 정선군 정선읍 정선로 1160,37.3817159,128.6445893
강원 정선군 고한읍 지장천로 859,37.2201239,128.8348594
강원 정선군 화암면 소금강로 1014,37.3120523,128.8132374
강원 정선군 북평면 서동로 2085,37.4515374,128.6659799
강원 정선군 남면 문은단로 8,37.26753,128.7415616
강원 정선군 고한읍 고한2길 3,37.2043377,128.8496571
강원 정선군 임계면 백두대간로 1377,37.4965082,128.84981
강원 정선군 임계면 서동로 4682,37.496327,128.8632352
강원 정선군 신동읍 강원남로 4182,37.2702964,128.6724422
강원 정선군 임계면 서동로 5584,37.5311915,128.9263836
강원 정선군 사북읍 소금강로 3283,37.2369121,128.8608104
강원 정선군 사북읍 사북중앙로 83,37.2268923,128.8235019
강원 정선군 임계면 백두대간로 35,37.3960408,128.8669955
강원 정선군 화암면 소금강로 538,37.3120523,128.8132374
강원 정선군 북평면 오대천로 564,37.4696216,128.6191448
강원 정선군 신동읍 의림로 60,37.2004199,128.6332317
강원 정선군 북평면 오대천로 326,37.45770479999999,128.6307478
강원 정선군 여량면 서동로 2783,37.4745064,128.7141613
강원도 정선군 임계면 서동로 4570 ,37.4941202,128.8513413
강원 정선군 정선읍 서동로 1199,37.396494,128.665836
강원 정선군 남면 강원남로 5284,37.249839,128.7788558
강원 정선군 정선읍 서동로 1348,37.4058096,128.6734232
강원 정선군 정선읍 애산로 1,37.3724686,128.6697819
강원 정선군 신동읍 강원남로 4123,37.2673869,128.6712346
강원 철원군 철원읍 금학로 469,38.2287699,127.2121366
강원 철원군 동송읍 태봉로 1952,38.1925207,127.275605
강원 철원군 근남면 하오재로 2084,38.2399827,127.4715274
강원 철원군 갈말읍 호국로 4532,38.1282752,127.2994527
강원 철원군 동송읍 이평로 7,38.2106196,127.2231265
강원 철원군 동송읍 오덕로 274,38.2315556,127.2401317
강원 철원군 갈말읍 갈말로 7,38.1832497,127.2999951
강원 철원군 갈말읍 호국로 5007,38.1667081,127.3158675
강원 철원군 서면 금강로 7645,38.2014854,127.4214445
강원 철원군 갈말읍 태봉로 1421,38.1844826,127.3334603
강원 철원군 서면 와수로 341,38.2503329,127.4497585
강원 철원군 갈말읍 호국로 5155,38.1766184,127.3264202
강원 철원군 철원읍 금학로357번길 2,38.2191497,127.2105422
